<?xml version="1.0" encoding="UTF-8"?>

<im-notice-mobile-config xmlns="http://www.intra-mart.jp/notice/mobile/config/im-notice-mobile-config"
    xmlns:xsi="http://www.w3.org/2001/XMLSchema-instance" xsi:schemaLocation="http://www.intra-mart.jp/notice/mobile/config/im-notice-mobile-config ../schema/im-notice-mobile-config.xsd">

    <proxy enable="false">
        <host></host>
        <port xsi:nil="true"></port>
        <username></username>
        <password></password>
        <workstation></workstation>
        <domain></domain>
    </proxy>

    <asns name="asns-apns">
        <endpoint>sns.ap-northeast-1.amazonaws.com</endpoint>
        <platform-application-arn></platform-application-arn>
        <access-key></access-key>
        <secret-key></secret-key>
    </asns>

    <asns name="asns-fcm">
        <endpoint>sns.ap-northeast-1.amazonaws.com</endpoint>
        <platform-application-arn></platform-application-arn>
        <access-key></access-key>
        <secret-key></secret-key>
        <fcm-project-id></fcm-project-id>
        <fcm-application-id></fcm-application-id>
        <fcm-api-key></fcm-api-key>
        <fcm-sender-id></fcm-sender-id>
    </asns>

    <asns name="asns-baidu">
        <endpoint>sns.ap-northeast-1.amazonaws.com</endpoint>
        <platform-application-arn></platform-application-arn>
        <access-key></access-key>
        <secret-key></secret-key>
        <baidu-api-key></baidu-api-key>
    </asns>

    <fcm name="fcm">
        <url>https://fcm.googleapis.com/v1/projects/%REPLACE_WITH_PROJECT_ID%/messages:send</url>
        <project-id></project-id>
        <application-id></application-id>
        <api-key></api-key>
        <credentials-file></credentials-file>
        <sender-id></sender-id>
    </fcm>

    <fcm name="legacy-fcm">
        <url>https://fcm.googleapis.com/fcm/send</url>
        <project-id></project-id>
        <application-id></application-id>
        <api-key></api-key>
        <server-key></server-key>
        <sender-id></sender-id>
    </fcm>

    <push type="android" engine="fcm" />
    <push type="ios" engine="asns-apns" />

    <max-push-subject-length>30</max-push-subject-length>
    <max-push-body-length>70</max-push-body-length>
</im-notice-mobile-config>
